subreddit,kind,created_utc,created_dt,month,mention_count,keyword_hits,score,author,id,text,title,num_comments,permalink,parent_id,link_id
OpiatesRecovery,submissions,1698040283,2023-10-23 05:51:23+00:00,2023-10,2,['narcan'],1,izzyrawrgrr,17edfhn,"Fetanyal overdose narcan twice before brought back So it was a suicide attempt, I never tried fetanyal before that night and didn't know that's what the pill was I snorted. Pure fet, after I snorted it I curled up in the recliner to go to , it was around 6 am. I turned Wipeout on the TV and closed my eyes. Next thing I actually remember was coming out of my coma for a spilt second because I was choking on something down my throat. I kept trying to rip the breathing tube out everytime I'd snap awake just to go out again. I spent three days in the icu before I woke up. To find out my whole left side was fucked. My arm couldn't move I couldn't lift the fucking thing. I fucked my siatic nerve, diagnosed with dysplasia in my shoulder, bursitis in my elbow, nerve damage, lots of brain damage. I was found by my friends Gma who gave me my first narcan for nothing to happen the ems did it again once they got to me. I'm curious on how yall think I fell out of the recliner that night and how did I fuck up my body like this? They told me I was found down and unresponsive for an unknown amount of time. I also feel like I am not who I was before I died. I had a twin sister who didn't make it to birth with me but i used to see her spirit all the time after that night I haven't seen her. I feel like I act differently, dress differently. Any ideas thoughts yall, wasn't my first attempt sy unaliving myself. Feel like it won't be the last either lol",Fetanyal overdose narcan twice before brought back,6.0,/r/OpiatesRecovery/comments/17edfhn/fetanyal_overdose_narcan_twice_before_brought_back/,,
OpiatesRecovery,submissions,1595900158,2020-07-28 01:35:58+00:00,2020-07,1,['naloxone'],1,meatrake,hz5hv2,"Advice on using Suboxone to Kick Heroin I am hoping someone can give me personal experience advice about using Suboxone/Naloxone (8mg/2mg) while kicking heroin. I have heard that if I cut the strip into smaller portions and then just use it for a short period of time it can help to lessen the withdrawal symptoms. Something along the lines of 2mg the first day, 1mg the second day, 0.5mg the third day and so on for a period less than a week. Is this method legit? I am afraid I will just be prolonging the withdrawal and when I stop taking the Subs I will still have to deal with it.",Advice on using Suboxone to Kick Heroin,3.0,/r/OpiatesRecovery/comments/hz5hv2/advice_on_using_suboxone_to_kick_heroin/,,
opiates,submissions,1644035127,2022-02-05 04:25:27+00:00,2022-02,1,['naloxone'],2,user20342r24234,sky0sj,"My expedited Bernese method of getting on subs.. So I’ve been doing this method whenever I get on subs by myself and it is “painless”. Well I felt 60-80% for the first 1-3 days and in those days I was still able to complete my 9-5 job. I am also able to sleep in the discomfort cause it’s not so bad. So my understanding of how subs work is it has a high affinity to the receptors than heroin or whatever. Precipitated wd happen when the subs kick off the opiates on the receptors not cause of the naloxone. So with this, I tested it out and it works every time. Just need will power and the hatred of the routine of using to get you through it. DAY 1: 10-12 hours (mild wd) in I take .125 of subs in the morning -wait an hour, feel my withdrawals come in faster (slight precipitated wd but it’s manageable) when this happens I smoke heroin. Around 12, I take another .125 mg of subs wait an hour then smoke. By now I feel awkward. My body is confused but I am still functioning. I bump subs to 1 mg around 3 pm wait hour then smoke. By now I can’t get high off heroin. Subs are slightly blocking my receptors. When this happens I know subs are in my system and I can bump up the dosage. At night time I take 1.5 mg wait an hour then smoke. DAY 2: body is still confused but manageable. I go to work, take 2 mg sub in the morning, wait an hour and smoke. By now I really can’t get high. So basically when I do smoke, it’s to make me feel better. 12 PM take another sub, smoke. Nighttime, take 2 mg sub smoke sleep. DAY 2 is the worst day. Most uncomfortable. DAY 3: wake up feeling 90%, have no urge to smoke so I just take a sub (doesn’t matter how many mg at this point) 8 AM 12PM 7PM is when I take my subs for this day. I really only smoke as needed on day 3 and it’s not a lot. I probably only smoke .2G total compared to my 1.7g daily habit. Day 4: now you’re 100% and completely on subs. The reason why I smoke while inducing subs is bc my theory is subs can’t bind to all the receptors instantaneously like heroin which is why you feel shitty so using another opiate latches on to those receptors which ease the withdrawals. But when I’m smoking on day 1-3 my goal is not to get high, it’s to ease the wd pain so I’m barely using any. My daily habit is 1.7g and throughout these 4 days I used 2.5gs. I would recommend upping dosage on day 4 to keep the cravings at bay and have a higher success rate of not relapsing. Lower dosage after like 7 days to where it’s comfortable. I aim for 4 mg subs a day. I wish detoxing or getting on subs is painless but there’s no way to cheat out the pain. You must go through some discomfort. This way is manageable. I cannot skip a whole week off work, I just needs get through 4 days of feeling shitty. It will differ for everyone which I see is a problem but for me, I am very aware of my body and what it is telling me. I listen to it and take the subs or smoke.",My expedited Bernese method of getting on subs..,3.0,/r/opiates/comments/sky0sj/my_expedited_bernese_method_of_getting_on_subs/,,
opiates,submissions,1479804788,2016-11-22 08:53:08+00:00,2016-11,1,['narcan'],5,[deleted],5e9rep,"Narcan Availability Map/List, State by State - Most Up To Date I Could Find","Narcan Availability Map/List, State by State - Most Up To Date I Could Find",3.0,/r/opiates/comments/5e9rep/narcan_availability_maplist_state_by_state_most/,,
opiates,submissions,1575154757,2019-11-30 22:59:17+00:00,2019-11,2,['naloxone'],1,meprobamatedowned,e454nv,"Can i prevent an od with ORAL NALTREXONE (Not naloxone, naltrexone, slightly different pharmacology) Like if i think i just took a too large dose of morphine, i'm alone in my room, i have pills of naltrexone, will taking one orally be as effective as naloxone to counter morphine od ?",Can i prevent an od with ORAL NALTREXONE,23.0,/r/opiates/comments/e454nv/can_i_prevent_an_od_with_oral_naltrexone/,,
addiction,submissions,1557084345,2019-05-05 19:25:45+00:00,2019-05,1,['narcan'],38,palpoutin3,bl1v6i,"[Text][Trigger Warning] The Gift of Life - How Dying Taught me how to Live February 2nd, 2015 It was cool. The breeze buffetted against my dry, pallid skin as we took the all too familiar drive to that initially terrifying neighbourhood in Fort Worth. The skies were clear, and suprisingly so was my mental state. Detoxed and checked out of rehab, freed from the shackles of heroin addiction and withdrawal I sped down that highway, eager to chain myself once again. The 1987 Toyota Camry rattled, sputtered, but still pushed on through to where we needed to go. We sat, waiting impatiently but ever servile to the casual whims of our fickle dealer. Sitting, waiting, after an hour of sweat, dry heaving, cursing, and sneezing from the two withdrawing friends who were with me, he finally sauntered over to us. “Heyyyyy budday, how was rehab?” He asked, jovially. “Fuck that shit, man” I said, eagerly giving him the money as to not let my friends suffer any more than necessary. “Be careful with this, man. You know R\*\*\* OD’d when he left rehab a few months back, I don’t want that to happen to you.” He said with a degree of seriousness I had never seen from him. “Yeah yeah man I know I’m not going to fuck up” Just words. I wanted to get high. “Promise me” Product divided we rushed to the nearby parking lot. D\*\*\*\*\*\* went inside to the bathroom, wary of our chosen spot he decided to use inside the grocery store. M\*\*\* and I, who had been in a ‘misery loves company’ relationship that only fueled our mutual self-destruction stayed in the car, we wasted no time. Those veins I had obsessed over and stared at during my stay in rehab, quietly mapping the first one I would use now that my arms had somewhat healed made it easy to do quickly. M\*\*\* was having trouble finding hers due to the speed with which as soon as a vein was found, it was unceremoniously pummeled into submission until it was no longer usable. She strained, as I floated off. The freight train hum of IV cocaine, a sound caused by the sudden rush of blood to the brain along with an instant high was quickly followed by a much heavier than usual comedown brought on by the heroin. The experience, for me, lasted 10 seconds and just as I was mumbling something about “…arm is already… itchy” and died. As my mumbled turned to a murmur, my consciousness closed around me from the outside and the ring of black squeezed in from my peripheral vision until I was met with complete darkness. M\*\*\* was used to this, I never cared much for limits and there were plenty of times where I had passed out and nothing ever happened – plus she was too concerned with getting her own high to notice. D\*\*\*\*\*\* returned to see me, lips blue and no longer breathing. This was before Narcan, before fentanyl, before people knew what to do with someone overdosing other than rumors and urban legends. He laid the seat back and M\*\*\* began giving me chest compressions and breath while he drove, panicking, to the nearest hospital. The same one where R\*\*\* had been left for dead on the front steps. I woke up with a head-splitting migraine and the faces of two people who had actually seen a ghost and saw someone come back to life. Like the ghost I am, I’ve been haunted by this. I was given a gift, a second chance at life and an opportunity to do better. Doing drugs was never the same for me, it tore me apart inside to waste the potential for a new life I had been given. ‘Potential’ I can’t tell you how much resentment I’ve had for this word in the past. Ever since I was a young boy, constantly those around me would tell me how much ‘potential’ I had, and as much as it is a compliment it is also a deep cut to the soul – because I never really lived up to it, and being constantly reminded of that didn’t make anything pleasant about what I was doing. I wanted to be left alone, to kill myself and to not have people constantly reminding me that I could be more than I was. There’s a certain point in my recovery where I had a realization of that potential, and as easy as it is to look back now and coldly analyze how wrong I was about that potential, it doesn’t make my purposeful ignorance of it any less real. Potential has new meaning for me, no longer is it who I could be but it is what I can do. My comfort zone is constantly expanding and no longer am I wasting these gifted days. Every day there is potential for me to make a difference in my own life or in someone else’s. People don’t understand why I take life so seriously now, but this is why. Because by any stretch of the imagination I’m lucky to have it at all, and if I don’t squeeze every bit of passion into every unearned day I would be doing the universe a disservice. I no longer run to what gives me comfort from things in my life that don’t go according to plan. I wait for those best-laid plans of mice and men to go awry because the biggest gift I can receive is an opportunity to see how much I can really handle. When other people run from unexpected problems, I run towards them – just for the thrill of the challenge. I’m a hammer, life’s a nail.",[Text][Trigger Warning] The Gift of Life - How Dying Taught me how to Live,7.0,/r/addiction/comments/bl1v6i/texttrigger_warning_the_gift_of_life_how_dying/,,
