subreddit,kind,created_utc,created_dt,month,mention_count,keyword_hits,score,author,id,text,title,num_comments,permalink,parent_id,link_id
opiates,submissions,1701266703,2023-11-29 14:05:03+00:00,2023-11,1,['naloxone'],1,sadanerlivet,186q5b2,Tilidin with Naloxone,Tilidin with Naloxone,0.0,/r/opiates/comments/186q5b2/tilidin_with_naloxone/,,
opiates,submissions,1639617922,2021-12-16 01:25:22+00:00,2021-12,1,['narcan'],1,black_snake_m0an,rhexyo,"If I narcan myself, can I take suboxone sooner?","If I narcan myself, can I take suboxone sooner?",10.0,/r/opiates/comments/rhexyo/if_i_narcan_myself_can_i_take_suboxone_sooner/,,
opiates,submissions,1699681947,2023-11-11 05:52:27+00:00,2023-11,1,['naloxone'],1,Charredlama,17so4nj,How do you separate the naloxone and oxy in a targin????,How do you separate the naloxone and oxy in a targin????,2.0,/r/opiates/comments/17so4nj/how_do_you_separate_the_naloxone_and_oxy_in_a/,,
opiates,submissions,1488259629,2017-02-28 05:27:09+00:00,2017-02,2,['narcan'],13,HallowedBeThyName_66,5wm6qd,"OD'd for the first time today. Wow. Scary. Shit. Needless to say, 0/10 would not recommend. And I'm not really trying to make light of the situation that I'll be honest really quite scared me. Over the last few months, I have managed to stay a recreational user, only once or twice every few weeks. Pfft I don't really know how, but I have been none the less. Well, I hit up my boy (basically my main connect) and he tells me ""Yeah, I'm omw back from re-up so I'll stop up to you on my way home"" Now this guy is a pretty good connection. Never really had much of a problem with him at ALL and he's always been straight up with me about price/quality, if he's got bags or grams, and it's always been a successful deal with never to much waiting. And it's always consistent. He always tells me if his shit changes. Mistake Numero uno. Anyway, I grab 6 bags from him cuz it's all I really had the cash for, and that would normally get me a very nice high, without it being to much. He drops it off. I go into my bathroom. Mix up 3 because like I said all I could afford was 6, and that would normally get me 2 buzzes. Ahh, so I plunge, and almost immediately think damn, that's some strong shit right there. I walk outside to my rides car to go to the store, maybe 30 seconds after I hit and BOOM. Next thing I realize it's like 2 hours later and I'm in the hospital, vomit all over me, and they are sitting there telling me I stopped breathing for who knows how long and they did not thing I was going to make it. I'm assuming it was fent cut, because I've never had that happen to me, I'm always careful, and like I said my boy told me it was the same from the other day. Needless to say fam, that was some god damn scary shit. My second mistake was thinking that that could never happen to me. Oh how wrong I was. Only took about 1 minute from the time I plunged to the time I hit the ground. Thank God my friend was there to call 911 and get me to the hospital quick enough. That honestly is probably the most freaked out I've ever been. And looking back on it I never would have even known I fucking died. I don't remember a fucking thing until the ambulance ride was half over and even then it's really just one big blur. I don't really know why I'm posting this other than to say I'm damn grateful for narcan and to be alive. Also I just want to reiterate. ALWAYS TEST SHOT OR SNIFF A LINE. I got too confident in myself and put in too much trust for my boy. You honestly never know what you are getting and you can NEVER, and I repeat, NEVER be too careful. I'm still very groggy and I'm planning on falling asleep very soon. Just be safe out there fam. I got cocky/over confident and that shit put me in my place fucking faster than you can even say the word Narcan!!! So please, stay safe. Sorry for the wall of text and if anyone has any questions I'll be happy to try to answer them to the best of my ability. TL:DR Got the shit I thought was the same as the other day. Did half of what I would normally do to save bags. Very nearly died because I was over confident in myself to be able to spot what I assume was mostly fent. Much love fam",OD'd for the first time today. Wow. Scary. Shit.,20.0,/r/opiates/comments/5wm6qd/odd_for_the_first_time_today_wow_scary_shit/,,
opiates,submissions,1472410967,2016-08-28 19:02:47+00:00,2016-08,1,['naloxone'],67,leatherandlaces,500uah,"This is fluffydreamz, we just lost another member...😞 Hey, I had to delete my account because of this stalker guy in my real life, but anyways...I just got a message from a friend of draintheblood666, he was an active member of this community with a heroin addiction and unfortunately he died of an overdose. Jim, that was his name, was an AMAZING person, I loved him so much. I've known him for almost two years, we connected here on r/opiates. We talked a lot, great guy, always knew how to make me smile, but more importantly - he saved my life. Jim helped me stay positive during the beginning of my struggle with opiates, and he kept me from taking a very dark path and was there to help me when I wanted to end my own life. Without Jim, I wouldn't be here. He was such a great guy, easy to get along with, had huge dreams, loved strongly, and always lived life like there was no tomorrow. I tried to help Jim many times, I sent him money when I had extra (he lived in California and I live in Canada) I offered to pay for methadone treatment, but as you all know, ending this shit is so hard. Jim was always there for me, I wish so badly that I could have been there for him. I hope his death was comfortable, I hope he just fell into a fluffy dream state where everything was perfect. Jim, if you're reading this somehow, know that I love you. I always did, you were one of the best things that ever happened to me. I wish I could hug you and go for one last car ride through Texas hill country. You saved me. If anyone knew Jim or hell even has something comforting to say, that would be really nice because I'm just here alone crying while I write this. Please be safe out there and get Your hands on some naloxone. I will send it for free if it will save a life. I love all you guys, and Jim did to. 😖😞❤️","This is fluffydreamz, we just lost another member...😞",54.0,/r/opiates/comments/500uah/this_is_fluffydreamz_we_just_lost_another_member/,,
OpiatesRecovery,submissions,1597841117,2020-08-19 12:45:17+00:00,2020-08,1,['narcan'],3,Helpopiatetwy,icmxuh,"Help for combined fentanyl and methadone withdrawal I could use some advice. Yesterday my son went to the methadone clinic. Less than an hour later he shot up fentanyl and OD'd. The hospital administered narcan, watched him for about an hour, then discharged him. He's decided that he wants to stop both, cold turkey. I've tried to talk him into staying with the methadone, at least for a while, and starting by stopping just the fentanyl. He says no. I think he might change his mind, but I also understand why he just wants to be 'done' with all of this. Now, my question is this. I know there are no miracle cures here, but is there anything I can get with him to help with his symptoms? I do know that he struggles more with the body symptoms like RLS and aches and pains more than stomach distress. FTR he's currently on 220 per day of methadone, and does between 6 and 9 caps a day of fentanyl injected. Also in the interest of disclosure, I suspect he may have some fentanyl caps put away somewhere. But he'll run out of those eventually. So if he's not facing full withdrawal starting today, I know it's coming, and I just want to help.",Help for combined fentanyl and methadone withdrawal,15.0,/r/OpiatesRecovery/comments/icmxuh/help_for_combined_fentanyl_and_methadone/,,
opiates,submissions,1547995550,2019-01-20 14:45:50+00:00,2019-01,5,['naloxone'],3,xonoro,ahy77y,"the time i accidentally narcaned myself (kinda) So in Aus we have Targin tablets which basically have half the oxy dose in naloxone as well, 60/30, 40/20, etc. I pissed off my doctor one week, thats another story lol but anyway she took away my Sandoz Oxycodone 80mg (fucking beautiful green bastards) and replaced them with this targin shit.... I usually shoot my 80s nut thats a no go with targin... Wanting to get some sort of pain relief and a slight buzz I crush a few targin up and parachute them... Then I go to smoke a cone but kinda choke on it and just know im gonna spew. Before i can do anything i start to spew but trying to hold it in till i get a buck it come out my nose. Now ive just swollowed like 120mg of naloxone. But that doesn't seem to register with me untill a minute fter i sit back down. I start to get anxious as fuck, like gonna die anxious, then start to shake and shit, feel like im sick as hell, but i cant be cos I just ate like 240mg of oxy. I have no clue why im feeling like this till my girl asks if naloxone is absorbed in nasally. O shit i think to myself, fuck i just narcaned myself. I look up how long naloxone takes to wear off and lay down, accepting that im gonna be in PWD for an hour. Fml. Fuck this targin shit, im getting my Sandoz back next week I tell myself lol. So yeah pretty shit story but im bored and it's one am here so not much to do... Tldr: took 240/120mg oxy/naloxone, spewed, up my sinus, out my nose like five minutes later, sit down, PWD kicks in, life sucks for that hour or so.",the time i accidentally narcaned myself (kinda),5.0,/r/opiates/comments/ahy77y/the_time_i_accidentally_narcaned_myself_kinda/,,
fentanyl,submissions,1616106665,2021-03-18 22:31:05+00:00,2021-03,1,['narcan'],2,Next_Faithlessness19,m82joc,"withdrawals not as bad as expected? my last dose was approximately 30 hours ago of 1-2 v dark blue dirties per day. I tapered slightly and took a half of a sub strip last night with plenty of benzos and also snorted some NARCAN at about noon today (cuz I don’t IV, i microwaved it and scraped the powder up). My question is why aren’t I withdrawing harder? Are the benzos saving my ass that hard? I only have cravings and slight stomach cramps but I can still eat and haven’t thrown up. Any input would be appreciated, I wanna kick this addiction. It’s the devil and I hope I feel this good all 4 days of hell",withdrawals not as bad as expected?,9.0,/r/fentanyl/comments/m82joc/withdrawals_not_as_bad_as_expected/,,
Drugs,submissions,1585828077,2020-04-02 11:47:57+00:00,2020-04,1,['narcan'],1,[deleted],ftky3p,"If you are narcan twice to be revived about 3 hours ago, would you still be able to get high after the fact? Any help would be appreciated","If you are narcan twice to be revived about 3 hours ago, would you still be able to get high after the fact? Any help would be appreciated",1.0,/r/Drugs/comments/ftky3p/if_you_are_narcan_twice_to_be_revived_about_3/,,
OpiatesRecovery,submissions,1484215354,2017-01-12 10:02:34+00:00,2017-01,1,['narcan'],8,Nick215philly,5nikml,"My story of recovery being told I was braindead while on a ventilator Hey everyone I just wanted to share my story on what I went through last February and how I recovered. And why there's always light at the end of the tunnel and happiness. On February 19th I overdosed using dope after relapsing a week prior. It was about 10 am I'm guessing when i actually fell out but I don't know for sure. I was apparently out until 10 pm when my sister said she found me, I was completely blue and the EMTs gave me 3 doses of narcan when I didn't respond they started rushing me too the hospital. I started to feel and hear everything at this moment but was completely unresponsive couldn't breathe, move ect. But I felt and heard everything from me struggling to breath to the paramedics trying to revive me and everyone panicking around me. I completely stopped any breathing on the way to the hospital and then my heart stopped. They got me there in Time though the get me on a mechanical vent. The next thing I remember hearing was my sisters come in and cry by my bedside. We've been threw similar situations with both of our parents both died from heroin overdoses. I remember the nurologist repetitively picking up my arm and dropping it saying ""see nothing"". She described my brain as being fried and that I would be blind, deaf, and paralyzed even if I did survive. I just want to emphasize that I felt everything from the aid coming to bathe me to them sucking the mucus from my lung to prevent pneumonia and all the pain stimulus tests to me biting down on the ventilator tube as that's all I could do. I was eventually transferred to capital health in trenton two weeks later because it's a trauma center. They put a trach tube in and all I have too say is thank god they transferred me because I had some of the best therapists at that hospital. It made me realize that there Really is great people in the world. My speech therapist would come in and talk to me for an hour everyday just in case I could hear her and that really made a difference in my mood inside. Then out of nowhere I woke up March 25th almost completely fine I had just lost a drastic amount of weight and was very weak. I met alot of great people through all of this and I'm very happy I experienced this in a sense because before I was heading down a fucked up road. Lost my parents to dope and I followed in there footsteps. Grew up in a rough area in Philly, frankford. But if this didn't happen I wouldnt of gotten the help I needed and now I got a second chance at life and I been clean since that day. Never been happier either. But if you know anyone that's on a ventilator or a vegative state please talk too them cause I truly believe people talking and visiting me saved my life.",My story of recovery being told I was braindead while on a ventilator,12.0,/r/OpiatesRecovery/comments/5nikml/my_story_of_recovery_being_told_i_was_braindead/,,
Drugs,submissions,1527266083,2018-05-25 16:34:43+00:00,2018-05,1,['narcan'],34,Nick_dipples_yo,8m34v3,"The Needle Exchange. All IV users read Im going to start off by saying i believe my state only has one needle exchange, as we are a VERY small state, with a BIG opiate problem. I've been using for years, have sold dope to support my habit for a long time (ended up eventually breaking even and using 5 grams of fent a day) So, the needle exchange is only a couple miles from my house i found out (never bothered looking because you get syringes at the pharmacy here without id or prescription) and it was awesome. It pains me to admit im on May and still using and i even felt weird telling the worker there. They had every thing, these awesome little cookers, alcohol swabs, sterile water, antibacterial goo or whatever. He started me off with 100 syringes FREE and a sharps container. I even got to pick my poison, 28 gauge 1m half inch. If you use, please take the time to use these programs. The reason people get absecces, lose limbs, are simply from being negligent and dirty. Use alcohol swabs, use a fresh syringe, DONT USE PUDDLE WATER. I dont care how bsd you think you have it, your life is valueable. Living a lifestyle where every shot could be your last, take the time to be cautious. Edit: i would like to add i have stopped using fentanyl as it almost destroyed my life. No, heroin is not safer. But fentanyl is an absolute fucker. It will steal your soul. My connect is a lobg time friend and i havent ever tested positive for fent using his d. Beware if you dont use a solid connect - get test strips and ALWAYS Shoot with a buddy and have NARCAN Edit: just found this article. Unbelievable idk how they are still open. http://www.aidscareos.org/NewsEvents/ACOSAIDSNews/TabId/182/PostId/58/state-defunds-rhode-islands-only-syringe-exchange-program.aspx",The Needle Exchange. All IV users read,57.0,/r/Drugs/comments/8m34v3/the_needle_exchange_all_iv_users_read/,,
opiates,submissions,1648234741,2022-03-25 18:59:01+00:00,2022-03,1,['naloxone'],1,Terrible-Way-4534,tnwfao,Buprenorphine w/o naloxone: I want to take this to avoid withdrawal when DOC is unavailable. Is there anyone here who has used Buprenorphine between drug use?,Buprenorphine w/o naloxone: I want to take this to avoid withdrawal when DOC is unavailable. Is there anyone here who has used Buprenorphine between drug use?,1.0,/r/opiates/comments/tnwfao/buprenorphine_wo_naloxone_i_want_to_take_this_to/,,
opiates,submissions,1621487254,2021-05-20 05:07:34+00:00,2021-05,1,['narcan'],7,amandabanana077,ngrf55,"what happens if you narcan someone who is high on dope but they aren’t overdosing? question basically explains itself, will they just get something like PWD or will they just lose their high?",what happens if you narcan someone who is high on dope but they aren’t overdosing?,10.0,/r/opiates/comments/ngrf55/what_happens_if_you_narcan_someone_who_is_high_on/,,
opiates,submissions,1462217578,2016-05-02 19:32:58+00:00,2016-05,1,['narcan'],7,barscarsandguitars,4hjcda,"To all of you who ordered those Narcan stickers from me! First off, thanks! You guys are awesome! Second, I added a shirt as well. A few of you asked me to do so since I mentioned I print custom decals AND shirts at my store, so I figured why not. Third, and most important - I'm going to give it another day or so before I process the orders in an attempt to catch any procrastinators ;-) If you still want anything, they're very much still available, so PM me! THANKS AGAIN!",To all of you who ordered those Narcan stickers from me!,9.0,/r/opiates/comments/4hjcda/to_all_of_you_who_ordered_those_narcan_stickers/,,
opiates,submissions,1560376859,2019-06-12 22:00:59+00:00,2019-06,1,['narcan'],6,larpking1,bzxe7l,"Reminder: street fent ain’t pharm fent My back is hurting now and Kratom just isn’t going to do it, it’s been a week since I quit my normal $100/day bag, looks like I won’t be getting any sleep tonight... until I find it... a 12.5/hr Mylan fetty patch. I’m just Gunna put this on for Few hours when I get cravings I said to myself. I put it on for a few hours but don’t feel shit so I decide to put some tape over it bam that blissful euphoria hits me i take it off and go to bed. Wake up the next day to look at the patch, looks different, the patch is completely clear and the tape has a bunch of white shit all over it with faint Mylan writing, fuck it this is going to do something so I tape it to my lower shin and pull my heavy socks over it put my boots on and go to work. Half of my work day goes by and I feel mildly buzzed it’s getting old now so I decide I’m going to take it off. Pull back my sock take the tape off... holy shit there’s nothing on it, nothing it’s all clear. Panic mode hits, fuck i should just narcan now or maybe go to the hospital this isn’t going to be good. But being the proud person I am I go home and wait for the calm before the storm. 48hrs later my high is starting to subside. I have never been so high and scared at the same time. 48 hours of non stop waves of intensity each one a little stronger than before. And I only had this thing on for a couple hours. I somehow managed to provide just enough heat and moisture to extract the entire 72hrs of meds into my skin in just a few. I got lucky I split the patch in half with someone else. Had it been a full patch there’s no doubt in my mind I would have died or woke up in the hospital. But non the less the last 48 hours have been spent feeling ready to go at any time. This was not enjoyable, don’t fuck with fent patch’s they are unreliable, I was looking to abuse however simple change in your body temp can cause a deadly spike in the amount of medicine released. The drs and pharmaceuticals can’t even get this shit right but you think your dealer cut it correctly? Just a friendly reminder of why I got off this ride in he first place. Wish me luck I’m sure the withdrawals are coming for me soon.",Reminder: street fent ain’t pharm fent,19.0,/r/opiates/comments/bzxe7l/reminder_street_fent_aint_pharm_fent/,,
fentanyl,submissions,1658432413,2022-07-21 19:40:13+00:00,2022-07,1,['narcan'],3,[deleted],w4pozb,"my god..I sprayed narcan up my nose and for 30 minutes straight, I thought I was gonna die..","my god..I sprayed narcan up my nose and for 30 minutes straight, I thought I was gonna die..",12.0,/r/fentanyl/comments/w4pozb/my_godi_sprayed_narcan_up_my_nose_and_for_30/,,
opiates,submissions,1416855298,2014-11-24 18:54:58+00:00,2014-11,1,['narcan'],0,probpoopin,2nadel,"Bob's Mill is back on top! My recent experience, rundown and recipe. Some ass hat took some of my methadone and I ran out 3 days before refill time. So, it was off to the grocery store to find some seeds. I saw the Bob's but have been really underwhelmed with what I have gotten lately in terms of effect. Anyways, I said screw it, something is better than nothing. If anything I can stop my exploding colon and calm these legs a little. Most of you know, any relief is very welcome in that special hell we make for ourselves. Not looking to catch a buzz at all, I grab 2.5 pounds, 5 of the half pound bags. Took it home and washed them up withsome warm water and lemon. Shake shake shake. Low and behold, the waterI drain out is the nice dark brown color. Not the off white, yellow, this is some weak tea. I was still skeptical. Drank the nasty shit and waited. About 45 mins later I am glowing and feeling amillion times better. Not smashed or anything. I just def have a solid opi buzz going and am happy it was with tea. It should hold me over for at least a day or so. I figure I can make another batch or two tomorrow and go get my script early wednesday. So, Bob's Mill, for reasons I am unaware of is back to not washing. At least where I am. My process for making PST. I use 30mg methadone daily for pain. A bit of a tolerance, nothing crazy though. This dose had me at about what I would expect from 30-50 ish mg oxy. 2.5 lbs Bobs red mill, 1 large lemon 1 gallon container. enough WARM water to cover just to the top of the seeds. Add all of your seeds into the jug. Fill with warm water until the seeds are barely covered. Add in 1 large squeezed lemon.Shake the absolute tits off the jug for only 5-10 mins. Strain with whatever. Hold your nose and drink. Easy peasy. As always, don't be stupid with tea. There is no way to accurately measure strength. I have done this many many times. I am a trained medic and always keep a bottle of narcan in the fridge. Really, don't even use it as a first choice. It is a mess, time consuming and will def get you funny looks at the grocery store. If you are hurting because some dick thought you didn't need all your meds this month. Give it a go, but be safe. Happy nods friends!","Bob's Mill is back on top! My recent experience, rundown and recipe.",11.0,/r/opiates/comments/2nadel/bobs_mill_is_back_on_top_my_recent_experience/,,
OpiatesRecovery,submissions,1462372346,2016-05-04 14:32:26+00:00,2016-05,1,['narcan'],13,CNYfisher,4huq60,"89/90 Days No Suboxone Today is day 89, tomorrow(may 5th) is day 90. No suboxone.. This is another one of my goal/milstones. I feel the best yet since i began this journey. My sense of humor is coming back, sex drive is back, i can drive places now without nodding out, most things are better. Everything is going pretty good, as good as can be expected. Never thought i'd get this far, but Its all pretty easy now.(not trying to sound cocky). By easy i mean no cravings for opiates, no urges, I just don't want them. Especially suboxone. I just don't want any of them. It is totally doable. It seemed bad, was bad in the beginning but now, it was more than worth it. It was the best thing i have done for myself in a long time.. I hope you all can get off them and feel what i feel now. I know you can do it. Failure is not an option... There was an article in my local paper (www.syracuse.com/post standard.com) yesterday about immodium and loperimide. This article stated that now addicts are taking mass quantities of immodium to get high off them. It referenced 2 people who died from taking too much. Then of course they talked to a pharmacist who wants to make it so that the only way you can buy immodium is to make it like they do with sudafed. Only allowed 1-2 boxes a month, have to show ID etc.. These people want us to die I think sometimes. THe comments section below that article was people talking mad shit about how stupid addicts now are addicted to immodium. We shouldn't be able to have it, we all deserve to die, we made ourselves this way. That shit pisses me off. I see comments like that all the time in articles about narcan as well. Following these fucks logic, we should wish cirrhosis of the liver on everyone who drinks and lung cancer on every smoker. Clueless fucking Hippocrates.",89/90 Days No Suboxone,8.0,/r/OpiatesRecovery/comments/4huq60/8990_days_no_suboxone/,,
