subreddit,kind,created_utc,created_dt,month,mention_count,keyword_hits,score,author,id,text,title,num_comments,permalink,parent_id,link_id
Drugs,submissions,1611251949,2021-01-21 17:59:09+00:00,2021-01,1,['narcan'],33,LotusVibes1494,l23sdy,"My opiate/drug use story I typed this out in another sub and thought some might find it relatable here, or serve as a warning for those who are considering trying opiates. Life is weird in that you can't always tell where your decisions will ultimately take you, despite your best confidence that you're ""just enjoying yourself"". Happy to add detail or answer questions, I typed this out quickly: I first experimented with opiates in high school (round 9th grade). My friend and I recently discovered cannabis, and one night came across a handful of Vicodin 7.5mg w/ Tylenol. We tried 2 each, didn't notice much, had a fun night drinking some beers. And that was that. I didn't really touch opiates for a while, but proceeded to get deep into the world of drugs. I spent my time smoking weed, driving around selling it, trying psychedelics, doing coke at parties, etc....for years. Plenty of shady shit happening during this time like getting robbed, owing people money, people owing me money, getting possession charges, etc... I was straddling the fence between having a normal life (4.0 grades in school) and getting fronted pounds on the weekend, but it all seemed like I was just enjoying myself with my lifestyle. Flash forward to college, I'm home for summer break after sophomore year. My brother gets jaw surgery, and has a huge bottle of liquid Oxycodone syrup. A teaspoon is 5mg and there are like 500mg in this sucker. I became fixated on this bottle and taking it anytime that I could sneak some. Trying 10mg, then 15 at a time, then 20. I finally understood why people liked this stuff. I layed on the couch just soaking in the waves of itchy warmth. Fast forward - junior year college. A friend at home, and another at school, are into pills. Xanax, klonopin, oxy. I get mostly into xanax and become addicted to that. I also learn how to use the dark web to order drugs in general. Fast forward, senior year. I'm living in a suite with 3 other people. One of them starts dealing weed, coke, molly, and oxy. I have unlimited access. I start skipping parties on the weekend so that I can snort 30's and nod out in my room. I'm ordering xanax bars, and find that I can get oxy cheaper there too. It still all feels like just a good time to me, but a couple of my friends are getting worried about my usage. Go home for christmas break - I'm using pretty much every day when I can afford it, 30-40 dollars a pill. Now I need 2-3 pills to catch a nod. I hang out at my friend's place most days bc he has all the connections. One night, he can't get 30s, but he says our friend has some bags of dope. I'm jealous as fuck bc I'm starting to feel shitty, while him and the boys are already getting high. I'm actually terrified to try heroin (and repeatedly told people ""I would NEVER do heroin don't worry""), but the little baggies and powder looked innocent enough once they were in my hand. I tried a quarter of a bag.... Oh ok it looks like I didn't die, I can do more! I get a dirty version of an oxy high, with a WAY heavier nod as I do 2 of the bags. I just paid 20 dollars instead of 100 and got higher than ever. And there's something sexy about these little glassine bags with a purple city skyline stamped on them. The smell of the dope in my nose is musty/unique. Back to school for a final semester - my roomate is fuckin pissed that I tried heroin. Starts getting mad about the 30s. I keep ordering them and hiding it, and sometimes meeting my friend for heroin which I hide from everyone I know. Drug task force raids our room (due to my roomates dealing, having like 30 thousand dollars in drugs and a gun) and they take my drugs too but don't charge me. I get very sick for the first time + crazy anxiety from the benzo withdrawal and from just having had feds knock in the door. I graduate from college while sweating profusely. Come home, now it's time to become a full blown heroin addict! Within a year I'm using needles (I fucking hate needles but now I sit around jabbing my skin like it's nothing). I get a good job, but it's difficult to maintain and I spend all the money on dope. My life mostly consists of sitting in shady apartments poking myself, driving people back and forth to the hood so that I can get new connects or a free bag or whatever, and eventually selling it myself, buying bricks to sell in the suburbs. It was all about staying off sick, making it to work to do the bare-minimum, and getting a paycheck to continue the cycle. My arms are gross and covered in marks. Now my hands are destroyed. I'm hitting veins in my foot and underneath my legs sometimes. Eventually got caught shoplifting from a Target (I fucking new I was gonna get caught but I was so sick and also secretly wanted to get in trouble so I could get some help). Went to rehab to help with court, and got clean. Lasted a month, until one day I skipped my vivitrol shot for some reason (my subconscious was preparing to relapse and I didn't even realize it.) Relapsed on smoking crack, the dealer had some xans, and then I lost track of myself. Apparently I bought dope and rigs and overdosed. Brother saved me with narcan, hospital, back to rehab. Spent the next couple years in a beautiful, yet very unhealthy relationship with the girl I was using with most of that time after college, and saved her from several overdoses. Until I couldn't... we broke up and she relapsed and died on July first of last year. All of this shit has turned me off from heroin forever, I just can't fuck with it. These days I use cannabis mostly, concentrates, RSO n such. And I've had plenty of ""mini addictions"" since, like ""I did some nitrous oxide. I think I'll just keep ordering cartridges all the time now!"" that usually last for a couple weeks. Or trying kratom, or rolling every weekend at concerts, or drinkin too much beer when I'm bored, ordering too much crap on Amazon. These days life is good for the most part, though it's been a wild ass ride.",My opiate/drug use story,6.0,/r/Drugs/comments/l23sdy/my_opiatedrug_use_story/,,
opiates,submissions,1617901356,2021-04-08 17:02:36+00:00,2021-04,4,"['naloxone', 'narcan']",14,aabbcc42069,mmw9lo,"I overdosed yesterday (never have before) and it was traumatizing. My poor mother who searched for narcan; couldn’t find it— and then called an ambulance... is probably never going to forget this. This is where I draw the line. Waking up to 4 EMTs seeming furious with me. First and LAST OD. Out of all the consequences of using... this has by far been the worst. I don’t want to die. I was super close. I haven’t used since last June before this... and I did the tiniest bump of what I was told was real H. No more fent test strips unfortunately right now. They really wanted me to go to a hospital but I was able to tell them my name, the year, and the president... etc. I started crying as it was my first OD ever in the 5 years of using. They told me to quit my crying and next time they’re going to take me to the hospital and involve cops. But they didn’t so I can’t complain. Don’t get me wrong! They saved my life and I’m not bitter — I’m immensely grateful. Guess I’m not invincible like I thought. Never thought I would overdose.. My poor 94 pound mother saved my life. Chest compressions and whatever the operator on the line guided her to do. My poor girlfriend dealing with this after some of her best friends have actually died from overdoses (she’s older than me being 32 and I’m 26). She’s not an addict. They must have given me IV narcan or something IV because there was a small wound and gauze was on my arm... Fuck. This is a wake up call. I went out FAST. This shit is crazy potent and I ruined almost a YEAR of sobriety. This is where I draw the line. Glad the cops didn’t show up as well... I work at an awful grocery store when I’m not teaching guitar lessons and it’s filled with drug users shooting up in the bathroom everyday. I’m around drug use and drug talk daily and even got offered free meth while I was in an aisle stocking... This homeless dude said this stuff was weak (and pure H... yeah right) and gave me it for free?! I know he was manipulative and noticed I used before and probably wanted to get me started again with this bag he gave me. I shouldn’t have believed the “real H” claim because this dude thinks bupe doesn’t cause precipitated withdrawals but the naloxone does. And he argued with me that all fent metabolizes into morphine. I’ve done my research... I initially talked to him because I thought I could help distribute free narcan to these folks but I’ve realized I’m too early in recovery for risking that when I can barely help myself. How can I even process this? This was so awful and I never thought I’d experience this. I just need to vent. I’ve pushed away and given up all the good friends and situations in my life with my addiction. But I have a plan of action. I’m going back to school for pharmacology / chemistry soon. I found a place in my state that offers free peer recovery coaches and free help with new jobs and free college.",I overdosed yesterday (never have before) and it was traumatizing. My poor mother who searched for narcan; couldn’t find it— and then called an ambulance... is probably never going to forget this. This is where I draw the line. Waking up to 4 EMTs seeming furious with me.,41.0,/r/opiates/comments/mmw9lo/i_overdosed_yesterday_never_have_before_and_it/,,
opiates,submissions,1480705665,2016-12-02 19:07:45+00:00,2016-12,2,['narcan'],3,droids707,5g5363,"Overdosed for first time on a .1 of ""not shooters shit"" Was laced with fent Sonoma County. Title says it all. I was clean for 2 years 8 monthes off methadone and I decided to cop on Tuesday before work. I was asking my friend what the fucking differance was between ""Shooters shit"" And ""Smokers shit"". Asking him maybe the not shooters shit is not ment for shooting cause its got something else i it. He had no answer. He said it was all straight. We cop in DT Rosa from a delivery. Smoke .3 between 3 people and dip on the bus to his house. When I get there im offered a rig and I say fuck it, and ask once more ""Is there any reason I should be careful with this shit."" He says naw its straight. I ask his girl to get the Narcan out Just in Case. I do .12 shot and remember everything for about 60 seconds, describing to them how bomb it was and it was powerful onset. That was the last thing I remember. Next thing I know is theyve got me on the ground, ripped my shirt off, poured cold water on me and hit me with Narcan. They get me woken up and say Paramedics are on their way, I had less than a minute to grab my shit. But I was on probation, subject to search at any time, With a warrant. So I stashed the dope in their house, along with my herb, right as the paramedics are pounding on the door. They rush me out the door and leave, His GF only asking ""are you sure youre going to be OK?"" Now I got dope sitting in connects mommas house that I hid good. Keeping asking him if I can come get it. or do they believe I owe them it? Either of which I dont really mind. I wanna go to the house and get my sack, but I know it will bring negative energy to his moms house and I dont wanna do that to her. But I paid for shit, they lied to me about somethings, and ran away real quick at first chance. Im not gonna front, im a vindictive mother fucker and Ill burn shit down. But I partially feel like I owe him the D cause I didnt die. Should I try to get my sack back that I hid? TLDR: If youre in the north bay, when they say this $50g isnt shooters dope, its smokers. They mean it, its cut heavily with fent, and the shooters dope is just that, dope.","Overdosed for first time on a .1 of ""not shooters shit"" Was laced with fent Sonoma County.",20.0,/r/opiates/comments/5g5363/overdosed_for_first_time_on_a_1_of_not_shooters/,,
opiates,submissions,1428051595,2015-04-03 08:59:55+00:00,2015-04,1,['narcan'],1,[deleted],31aj0s,"the story of my fallout and EVERYTHING leading up to it for the last 2 years hey man, figured i'd start this assignment asap. Well it all started up in alaska, elmendorf airforce base (now know as JBER). I developed bad anxiety after my long time friend of 7 years died in a car accident. You'll forget about this part but my friend dying is an underlying issue that my therapist brings up every session. Anyways i met this new girl named Renee at school, and she was a total bombshell. But, i was 15 and you know how it is then - sex, drugs and metal. So one day we were at her house watching the Notebook,and she asks me if i want a drink. I said sure and she brought me pineapple smirnoff with orange fanta mixed in it. It was pretty bomb, like her ass. Big bags of jello on each backside. BUT that was my first time drinking, so i got a little wasted but not enough to black out so we had sex and i loved it. Because of her, though. At least that's what i thought.. So this goes on for a while, drinking and fucking like there was no tomorrow. Then gta 5 came out and my family went camping, so i had the weekend all to myself and a liquor cabinet full of Absolut and captain morgan, with some other small stuff. I figured i'd hit up renee and call her over, but she was busy fucking some other dude so i decided to drink by myself and just enjoy it. So i got black out drunk and i remember having to sit to pee but i still fell off the toilet - boy, what a mess. But fast forward a while of dicking with dxm and benedryl and some weed, we have to move to california. We get put up at base TLFwhile we move out. While staying there in the broken apartment (no heat in december in alaska) i come across my parents cabinet of medicine that is always locked. Well, it's a cheap piece of a safe so i broke it and took all the percs, roxicet, tramadol, multiple benzos and i end up getting prescribed xanax for the rest of the move, my parents don't know i have a substance issue and they don't know about their safe. I consider this point to be where i became addicted to opiates. I've fucked with xanax, dxm, benedryl, weed, alcohol, some percocet after my wisdom tooth removal, but this is what did it - binging for 4 days on heavy doses of opiates, being scared to go to sleep because i might not wake up, going on dates everyday with 3 different girls a day, getting laid and lasting at least an hour, being blacked out and emotionless all the time. We opted to drive down to cali, so we packed our shit and shipped it all down. Whatever we needed for the road we took with us in the truck to the farry, and started driving. We went through many different terrains up there, including cities and -45 degree frnht weather. it was a wild ride. All the while i was taking xanax around the clock. I was always looking for it, the xanax, whenever i got the chance. If my parents went out i checked their luggage and i still do to this day, check purses they left bags in corners pockets in closets. Exhilarating if you ask me. Anyways, fast forward to when i start working out in california. I was a 165 pound fucboi, couldn't bench 150 as a max. I met this kid named victor back in alaska, kid got all the bitches that i wanted because he looked like a grown ass adult. I wanted to be better. I started working out 6 days a week 3 hours a day to pump myself up. I got to 245 lbs in 7 months, benching 225 for 5 sets of 5 as an everyday workout, deadlifting 350 max, squatting 275 3x12, curling 60 pound ezcurl bar for 3x10. I was huge! I loved it, women loved it. Best thing ever. Ate like a tank eats gas, worked out like a tank crushing cars. Constantly getting compliments on my size. Then the drinking started back up, i was lonely. All i had was the gym, no school, no nothing. I gave it all up due to anxiety developing bad around this time. I drank to cope, drank to get drunk. Left all my friends back in alaska, failure in terms of everything but lifting, nothing was good. Just went to the gym, ate and played steam games. By the time i was 16 1/2 i was drinking a bottle of wild turkey 101 a day, straight out of the bottle. My dumb bitch therapist in rehab, 23 fucking years old straight out of college replacing my older, better therapist said ""that's such a teenager to do"". I was furious when she said that but i'm getting ahead of myself. Anyways, yeah, i was drinking a large bottle of liquor a day, stealing it from a local store, edging on the border of getting caught and getting arrested and sent to juvie. One day, where things picked up rapidly, i was at the gym benching my 225, when i decided to try this new form i heard about on reddit. Shoulder blades together. I came down on the rep and all i heard/felt was cracking, popping and tearing. I had nowhere to put the bar but back up on the rack. So i pushed. More sounds, more feels. I immediately felt shooting pain where i, a grow ass teenage boy couldn't bear it. i fell over. I went to the doctors, they gave me viatmin m/motrin and told me to stretch it. Mother fucker, that might work in basic but i'm a civilian teenager, you put me on some god damn vicodin and get me an xray. But no, he wasn't hearing it. I went back in the gym to stretch it out the following week, benched the bar and it happened again. I gave up. Hit the bottle hard, looked up how to cop opiates, where, how much it cost, everything. I decided half a gram of heroin would do it. I contacted a care packager and got a pack of 28 gauge needles, bought heroin off a guy i met. Went home, test shot, blacked out, alone. I blacked out alone in my house, my parents were out camping. On one hand i can see the fact that i may have been trying to commit suicide. I mean who combines xanax, benedryl, alcohol and heroin and expects to live? I shot up over the course of 24 hours before having a stroke and going into a coma, having seizures. I ended up shooting the entire half gram. Laid there by myself for 14 hours before my parents came home and i was escorted to UC DAVIS from david grant medical center. I was in a coma for 6 days, intubated for food for about 14, lost 55 pounds, couldn't remember how old i was when i woke up. But look at me now, a living ""miracle"", spreading information. TL;DR should read it if you're high and looking for a story. 17 year old od's on heroin. always have a trip sitter, always have narcan, always have a way to the hospital.",the story of my fallout and EVERYTHING leading up to it for the last 2 years,0.0,/r/opiates/comments/31aj0s/the_story_of_my_fallout_and_everything_leading_up/,,
opiates,submissions,1694540873,2023-09-12 17:47:53+00:00,2023-09,1,['naloxone'],1,Educational_Berry661,16gxyd4,"Buprenorphine Hello, my doctor has prescribed me bup without naloxone for several years online. Suddenly I’m told by the doctor the dea is stopping this product (generally called Subutex) which doesn’t make sense. Has anyone heard anything about this? I’m guessing she is saying this due to them coming down on telemedicine.",Buprenorphine,1.0,/r/opiates/comments/16gxyd4/buprenorphine/,,
addiction,submissions,1594009473,2020-07-06 04:24:33+00:00,2020-07,1,['narcan'],100,cragpossum,hm0wom,"Loving an addict I wanted to write this because over the last year I’ve found myself typing the same question into google over and over searching for answers to try and convey to my addict partner what life is like for me: What is it really like to love an addict? Loving an addict is in the same way the most selfless kind of love and the most selfish. Loving an addict is giving yourself entirely (emotionally, physically, mentally) to the addict and the addict’s well being. Loving an addict is being a martyr and a hero when no one really asked you to be. Loving an addict is exhausting, unbearable, painful, traumatic. Loving an addict is spending every waking moment wondering if they’re safe. If they’re using. If they’re lying. If they are where they say they are. If they are doing what they say they’re doing. Loving an addict is constant fear and dread that in the 2 hours you haven’t heard from them they have ODed and are dead. Loving an addict is waiting for the inevitable day you will either find them dead or get a phone call that their body was found if they do not recover. Loving an addict is watching their every move, questioning if their pinpoint pupils is a reaction to the light or if it’s due to opiates. Loving an addict is countless stays in detox and rehab, counting down the days until they will come home to you. Loving an addict is looking over their shoulder to see if the text they just received is from their family member or from their dealer. Loving an addict is counting your own Xanax every day (that you were prescribed so that you could function through the pain of loving an addict) to make sure that they didn’t take one or several when you weren’t looking. Loving an addict is waking up screaming and crying from yet another dream that they overdosed and died. Loving an addict is taking their car keys while they’re sleeping and searching every nook and cranny of their car to find evidence that they’re using. Loving an addict is carrying Narcan in your purse, AND in your car, AND keeping it in easily accessible spots in your home god forbid they use too much and you are the only thing standing between life and death. Loving an addict is taking on another person’s pain and struggle in addition to your own. Loving an addict is dedicating your life to making sure you remain responsible even when you are struggling to keep your head above water, so that when they are in a bind you can take care of the both of you. Loving an addict is lying to the other people in your life when your partner is in rehab and begs you not to tell anyone because he is so ashamed that he relapsed again. Loving an addict is living in shame and secret that the person you love is not everything they seem to be. Loving an addict is your ear to the bathroom door, wondering what’s taking so long. Wondering if you’re going to have to kick the door in because they’ve miscalculated how much they can use. Loving an addict is living in terror that this time, the dope they bought could be laced with fentanyl. Loving an addict is finding pawn receipts under the bed for items you cherished that they sold to buy drugs. Loving an addict is looking at old photos of you together and remembering that that was a time when they were high or a time when they were detoxing. Loving an addict is the abuse that comes when they are writhing in physical and emotional pain from detox and battling with their demon right before your eyes. Loving an addict is being begged not to give up on them when you are struggling to hold onto what is left of the hope that you have that this time will be the last time. Loving an addict is wondering why their love for you isn’t enough to keep them sober. Loving an addict is feeling like every ounce of joy and peace has been stolen from you. Loving an addict is talking them down from being on the brink of suicide because they don’t want to use anymore and can’t stop. Loving an addict is being called into your boss’s office at work, asked why you’ve been so distracted, why you keep asking to leave work early, and the real answer is because you are afraid if you don’t get home soon enough your partner may be dead. Loving an addict is seeing both the person that you love more than anything in the world and also a cruel monster you don’t recognize.",Loving an addict,45.0,/r/addiction/comments/hm0wom/loving_an_addict/,,
opiates,submissions,1678304838,2023-03-08 19:47:18+00:00,2023-03,2,['narcan'],181,vegan420lyfe,11m62g6,"We need to legalize to stop deaths Narcan resistant fent is killing people, why dont we as society allow people to use codeine or hydrocodone for pain? Both those respond very well to narcan in the extreme rare case of OD when ONLY using those drugs. &amp;#x200B; I was listening to dr phil podcast, and he claimed that having no deaths with a clinic like Canada has or nordic countries have with safe supply is ""letting the disease win"" &amp;#x200B; No dr phil its keeping people alive . But people like him would rather have their viewpoint of drugs be upheld than admit the paternalistic just say no approach ISNT WORKING &amp;#x200B; How people like that have any sway left is extremely disheartening, they would rather have 100k people die a year in US alone than consider ending the war on opiod users.",We need to legalize to stop deaths,120.0,/r/opiates/comments/11m62g6/we_need_to_legalize_to_stop_deaths/,,
