subreddit,kind,created_utc,created_dt,month,mention_count,keyword_hits,score,author,id,text,title,num_comments,permalink,parent_id,link_id
opiates,submissions,1481734333,2016-12-14 16:52:13+00:00,2016-12,1,['narcan'],39,bmnyblues,5ibn9l,"Update for anyone that gives a shit So as some of you know, i'm wrapped up in some legal shit since my homeboy fell out in my kitchen and they found a half a g on me and some paraphanelia, etc... Since then i've been trying my damnest to stay clean but im a weak willed junkie and kept slipping up. Well i finally got into a sub dr and the place i went does outpatient treatment, groups, etc.. it's a one stop shop for gettin clean. Thank jebus they take my insurance so now i'm finally getting some help. Counseling, group, meetings, half a sub strip twice a day and all for $0. Praying with the subs i can stay clean long enough to start pissing clean for CYS and the PO's office and if i can dodge them through friday they're closed sat and sun and i should be good by monday. For the first time in forever i actually feel hopeful about my future. Thanks for the support everyones given me and i hope your all staying well and safe, for the love of god and anyone you know that uses please please please get and keep narcan on hand and try not to use alone. My homeboy fell out off one line up the nose that was half the size of the one i did, fent hotspots don't discriminate so do what you can to reduce your risk and stay safe, even when it doesn't feel like it there's people out there that love you and care about you and would be devestated if you wound up a statistic. If your struggling to get clean or stay clean and feel hopeless reach out for help, it's out there and it's possible!",Update for anyone that gives a shit,68.0,/r/opiates/comments/5ibn9l/update_for_anyone_that_gives_a_shit/,,
opiates,submissions,1598478584,2020-08-26 21:49:44+00:00,2020-08,1,['narcan'],535,BigFishlag,ih8a8u,"Just saved a fellow bropiates ass. At Wendy's grabbing a bite. In drive thru. 3 cars up not moving and everyone is going around this guy and beeping. Dont stop to see if he is ok just right around him mind all thinking about baconators and shit. So I pull out of line thinking with my addict brain this guy is probably nodded the fuck out. I pull up beside him ,and sure enough he is clearly in full nod. I'm just hoping he isnt od'ing. I jump out of my truck run over to his side. His window is down. Eating his steering wheel. So I first yell twice BRO BROTHER WAKE UP. No response so I smack the strangers arm slightly , and tell him get up bro come on. Smack him again, and he pops up. Disoriented as all hell I'm like dude I know what's up I'm trying to save your ass here either pull up ,and park real quick or get the hell out of here because I'm sure someone called the cops by now. So he understands I'm trying to help him. He is like ok got it. He decided to pull up in a spot right in front of him ,but his truck won't move. So I hop out again to help him push it. Just then he gets it moving, and I see the manager walking up to see what's going on. I yell to the manager he us good he is having some problems with his truck. By this time homie has his bearings and is getting out of his truck while the manager is next to his truck checking things out. Then here comes the po po.... awww shit. Thankfully the manager told the cop he was ok having truck issues, and. The guy had his bearings enough to tell the cop the same ,and that he had just finished calling triple a. So he got away with this one. He walked past me as he was going in to get a bite to eat. I said you good bro. I know how it is I didnt want you to get locked up. He was like yeah I'm good. Thank you man I appreciate it. I was like all good im just glad I didnt have to narcan your ass. Anyhow I'm glad I help the man because if not he would be in cuffs right now ,and his life about to be an even more fucked up tangled mess. Stay safe y'all be careful where you catch your nods.... and if you see a fellow man in a spot try ,and help. Don't laugh and drive by.",Just saved a fellow bropiates ass.,138.0,/r/opiates/comments/ih8a8u/just_saved_a_fellow_bropiates_ass/,,
opiates,submissions,1693615919,2023-09-02 00:51:59+00:00,2023-09,1,['narcan'],5,Song-Thin,167ogui,"Guide: How to IV Opana You just bought yourself some Opana and are thinking gee wiz I can’t wait to get fucked! Congrats! Before you go and potentially give yourself a stroke/embolism from injecting the ER (almost) tamper proof medicine read this! These medications gel up when introduced to water pre extraction. If you shoot this gel or try to bypass it by heating the gel and inject it, you’ll soon begin to feel it’s hard to breath. Congrats you gave yourself an embolism and have a high risk of dying! I already lost one friend to this, sorry narcan doesn’t reverse it. So all you can do is wait there and watch a person slowly suffocate and regret all their life choices constantly telling you they are so sorry as EMTs arrive. This is specific to the G Series ER formulations. Find another guide for the IR. Step 1: Wash your hands and sterilize all materials you’re working with, put on sterile gloves (Can be found in cvs/amazon) Quick rub with an alcohol wipe (again cvs/amazon) across everything will suffice. Step 2: Grind your pill down completely into a fine powder. Step 3: Mix the powder with 91% Iso alcohol (CVS/Amazon) to where it is completely saturated and looks like it’s dissolving. There’s no issue in using too much here, as it will be removed later. Step 4: Take a leur lock syringe *amazon* (3ml/10ml) and draw up the entire solution of alcohol/powder. Step 5: attach a leur lock micron filter (amazon) to the end of the drawn up syringe and push the solution out into a new container. This will catch the leftover particles, the oxymorphone is dissolved in the alcohol. Step 6: repeat this until all of the original solution is filtered. You may have to use a new micron between each time you push. I also recommend running just pure 91% iso through the filter afterwords to pickup any remaining oxymorphone. Step 7: Take the filtered alcohol/Opana and put it into a metal container that you can heat. Step 8: Place it onto the stove on low/medium heat. You want it to sizzle very slightly so it evaporates. Don’t apply a lighter/high heat. If you burn it you’re fucked. Step 9: once ALL the alcohol is dissolved you’ll be left with a white/orange film. Add water and draw up with a new syringe, not the one that had alcohol in it. Step 10: use a fresh 26g+ needle to inject. Do it very slowly. The more distilled water you use to dilute it when injecting gives you a better feel for how much you need. Step 11: orgasm and be high for 8+ hours Step 12: spend all your money repeating these steps Step 13: Rehab before you try to buy heroin/fentanyl.",Guide: How to IV Opana,6.0,/r/opiates/comments/167ogui/guide_how_to_iv_opana/,,
OpiatesRecovery,submissions,1557024465,2019-05-05 02:47:45+00:00,2019-05,1,['naloxone'],1,tallyho347,bksz5a,"tips and questions for coming off suboxone So I've been on suboxone for 5 years prescribed by my doctor. I moved states and can't find a doctor so i'm coming off. I got down from 8 to 2 mg, now i'm drinking Kratom and using CBD flower to avoid the full effect of the WD's. It's been about 48 hours give or take. some chills but the kratom fights that off, and any achy body the CBD helps. I've been told this is one of the worst WD's. I've Withdrawn from Heroin and oxy cold turkey and wasn't an every day user. maybe every other day or almost every day but not like being prescribed suboxone that I take daily. So Is the WD for suboxone a slow onset because of the long half life or am I beating this thing?? I mean Heroin was bad Oxy was bad tis is slightly uncomfortable. Also after about 3 years the naloxone caused me anxity which is better now that i'm coming off. I also never used CBD/Kratom to come off. If this is full WD's I highly recommend this method for detox. ONLY THING, DO NOT OVER DO THE KRATOM. START LOW AND BUILD UP. It's not worth waste or the risk of an OD. I started with half a table spoon and am at about 2. Also too little and it's a stimulant, too much it's a hulicigen, just right it's a natural opoid that is weak enough that even with the risk of addiction you can come off of much easier. i",tips and questions for coming off suboxone,18.0,/r/OpiatesRecovery/comments/bksz5a/tips_and_questions_for_coming_off_suboxone/,,
opiates,submissions,1595332450,2020-07-21 11:54:10+00:00,2020-07,1,['naloxone'],2,[deleted],hv6154,Bioavailability of Naloxone Swallowed?,Bioavailability of Naloxone Swallowed?,10.0,/r/opiates/comments/hv6154/bioavailability_of_naloxone_swallowed/,,
Drugs,submissions,1697933988,2023-10-22 00:19:48+00:00,2023-10,1,['narcan'],1,Verde_Tres,17dgl6e,"Does Narcan make you sick afterwards if you use opioids after getting Narcanned? Just a quick question, as the title suggests. If you guys could let me know I’d greatly appreciate. I was under the impression it makes you sick.",Does Narcan make you sick afterwards if you use opioids after getting Narcanned?,14.0,/r/Drugs/comments/17dgl6e/does_narcan_make_you_sick_afterwards_if_you_use/,,
fentanyl,submissions,1674508300,2023-01-23 21:11:40+00:00,2023-01,2,['narcan'],6,Rich_Sheepherder_565,10jnn72,"Too much Fetty Causing Psychotic Episodes? Ive been experiencing this happening to myself and others since before fetty was even sold as pure product. Ive noticed in particular with IV users , when injecting a dose of fetty rather bigger than your tolerance can handle, at the break of actually overdosing , you black out and become incoherent. this demonic possession like state of being is frankly scary. Youre not you at all at this point. And can only snap out of it by riding it out. Say you dont snap out of it, next stage is an OD. you will fall out, rather if its fatal or not, without narcan you may not wake up in due time. . Ive woken up on my friends floor after a shot with him saying I screamed so loud the windows on the house were rattling. My voice box was scratchy for 2 weeks. No memory of it happening but I know it did. $mg of narcan administered. My friend said it was purely demonic. To sum it up to make other relate more, have you ever seen someone look as if they're demonically possessed, from taking too much fentanyl? Thats what this state of being can look like. Maybe looks more of a meth psychotic break than something we know to be caused by opiates. (my source is valid so yes , i know this is pure fent. No additives.) There has to be a link to dark energy, maybe even portals that this drug opens up. Real Spiritual warfare were talking about when you're under the influence to this extent, its like youre possessed. Some symptoms include, Screaming, bugging out on the ground hitting walls regardless of whose around, (completely blacked out in other words) uhhh blacking out is for sure a symptom, anger outbursts, dancing and literally acting as if youre possesed idfk how else to say it, aright? HAS ANYONE ELSE EXPERIENCED THIS SIDE EFFECT FROM TOO STRONG OF A DOSE OF FENTANYL? Since nearly dying dozens of times, im proud to say Im off the drug now. But still very much a part of the community and whats going on. S bein this problem is still occuring, take a look on youtube and check out Kensington Philadelphias videos, youll see plenty examples. Anyway this stuck with me and This was evidently traumatic enough for me to still think back and wonder if anyone else can relate. Stay Safe",Too much Fetty Causing Psychotic Episodes?,47.0,/r/fentanyl/comments/10jnn72/too_much_fetty_causing_psychotic_episodes/,,
Drugs,submissions,1648446779,2022-03-28 05:52:59+00:00,2022-03,2,['narcan'],482,GnarlieHussle,tq2idz,"my girlfriend overdosed on fentanyl A week ago, while I was inside home depot filling up my cart getting ready to walk out with a bunch of stolen items to sell to support our drug habit i noticed that my girlfriend still hasn't made her way into the store. Mind you she I just bailed her out of jail so she was about 3 weeks clean. She became a victim of sleeping tiger syndrome. I ditched the cart and peeped the parking lot and noticed that our car was still in the same spot I bounced out from and the headlights were on... I said fuck the cart, let me check on my baby. Got to the car and she wasn't breathing. She was gray in complexion with her fists balled up and when I opened her hands they were blue.. I immediately started doing chest compressions and mouth to mouth. when I would blow oxygen into her mouth her neck would expand like the air wasnt going to her lungs... i started panicking as visions of all the shit I'd have to deal with started flashing thru my head. I called 911, spoke with the operator gave them the deets and continued cpr... I remembered that we had narcan so i took her purse and dumped everything out onto the car floor to find it. I opened it and sprayed it into her nose... only then did I get a glimpse of her coming back but barely any movement still... I continued to do cpr on her for about 5 minutes then police finally arrived. The fire department and ambulance came shortly after... the police fuckin just grabbed lifeless body out the car and tried to make her stand up then immediately sat her down on the curb. By the time the EMT's were there she was finally coming to. They put her in the gerney and hauled her off to the hospital. I followed the ambulance. I can honestly say that was probably the scariest moment I ever had in my life... it was traumatizing as fuck and now I feel like I can't let her out of my sight... and to think if I took a little bit longer in that store she would've been a goner... Tldr; gf od'd on fetty. Had to narcan her. She made a full recovery. Now I have ptsd. Edit- just to be clear. I don't do heroin or fentanyl... UPDATE - yesterday was my girlfriend's birthday. I had a video visit set up with her for 7pm. I got an email at 6pm saying that our visit was canceled by the facility. Apparently she's in quarantine 24hr lockdown for the 1st 2 weeks in jail. What a way to spend your 26th, on 24 hrs lockdown. Was one of the cheapest birthday gifts I ever bought - 2 bags of cheetos 3 bags of doritos and 2 bags of peanut m&amp;ms. Sheesh! I had a pre plea interview with my probation officer yesterday as well and I will be starting drug court soon.",my girlfriend overdosed on fentanyl,451.0,/r/Drugs/comments/tq2idz/my_girlfriend_overdosed_on_fentanyl/,,
opiates,submissions,1561210630,2019-06-22 13:37:10+00:00,2019-06,5,['naloxone'],5,OneMorePillPlease,c3psal,"Naloxone - how exactly does it work? I'm taking Targin(20mg Oxycodone/10mg Naloxone in one pill), and having a hard time reading up exactly how Naloxone would affect if I e.g. took 120mg Codeine in addition to the Targin pill at the same time. Would Naloxone ""ruin"" the effect of both the Oxycodone and the Codeine, or none of them given my tolerance is so high(in other words, the Naloxone only works as a lifesaver if are close to OD'ing, and helps avoid/ease constipation).",Naloxone - how exactly does it work?,8.0,/r/opiates/comments/c3psal/naloxone_how_exactly_does_it_work/,,
opiates,submissions,1633490753,2021-10-06 03:25:53+00:00,2021-10,2,['narcan'],1,StandardChemist,q2c530,"Precipitated WDs from Narcan if not dependent on opioids? Hypothetical question, if an opiate-naive user were lose consciousness from a morphine overdose, would Narcan still send them into withdrawal if they aren't dependent on morphine?",Precipitated WDs from Narcan if not dependent on opioids?,2.0,/r/opiates/comments/q2c530/precipitated_wds_from_narcan_if_not_dependent_on/,,
opiates,submissions,1533078996,2018-07-31 23:16:36+00:00,2018-07,1,['narcan'],113,traceyh415,93jiyo,NARCAN,NARCAN,35.0,/r/opiates/comments/93jiyo/narcan/,,
Drugs,submissions,1600570622,2020-09-20 02:57:02+00:00,2020-09,1,['narcan'],4,mcdonaldsmystery,iw63g5,"Does using stimulants with opiates reduce the risk of overdose? Assuming that you don’t go overboard on the opiates because the stimulants mask some of the effects, would speedballing be less dangerous than just opiates alone? Also, if I didn’t have narcan and was waiting on 911 would it make sense to give the person ODing meth or coke or something? Or if I feel close to ODing and am worried would it be helpful to add stimulants into the mix? I couldn’t find much info on this when I searched online. Thanks! My confusion is coming from [this post](https://www.reddit.com/r/opiates/comments/7dt4tb/why_speedballing_heroin_and_cocaine_is/?utm_source=share&amp;utm_medium=ios_app&amp;utm_name=iossmf)",Does using stimulants with opiates reduce the risk of overdose?,22.0,/r/Drugs/comments/iw63g5/does_using_stimulants_with_opiates_reduce_the/,,
opiates,submissions,1594421824,2020-07-10 22:57:04+00:00,2020-07,1,['narcan'],1,H0VEMAN,hoz4e5,"Fentanyl OD question Let’s say someone has come in contact with Fentanyl on their hand by accident. For arguments sake, we will assume it is very pure. Would that brief contact be enough for that person to OD and it take three hits of Narcan to come back.",Fentanyl OD question,12.0,/r/opiates/comments/hoz4e5/fentanyl_od_question/,,
opiates,submissions,1526683173,2018-05-18 22:39:33+00:00,2018-05,1,['narcan'],5,silentcauga,8kh47r,"How much time do you have after an overdose? Assume the medication was taken orally or snorted. NOT IV. How long do they have before narcan would be ineffective? Also, how would this change if the person has other CNS depressants in their system \(alcohol, benzos, soma, etc\)? I know action should be taken ASAP but I'm just curious how long it takes from ingestion to irreversible overdose death.",How much time do you have after an overdose?,14.0,/r/opiates/comments/8kh47r/how_much_time_do_you_have_after_an_overdose/,,
opiates,submissions,1398051246,2014-04-21 03:34:06+00:00,2014-04,1,['narcan'],1,[deleted],23kau0,"Looking for some OD advice Hope everyone's night is going well, Let's say I possibly insufflated a bit too much opana er, and am worried about falling out. I was nodding for a good bit, but am worried that more could enter my bloodstream due to the drip. Right now I am quite fine actually, but for the future: Would it be a good idea to do a small line of adderall ir to simulate my nervous system if I began to notice symptoms of an OD? Thanks everyone! EDIT: Well I ended up doing some googling (which I should have done first). For those wondering, adderall will help only against respiratory depression, but not for an actual overdose due to toxicity. Narcan would be the option to stop the opiate from binding to your opioid receptors.",Looking for some OD advice,1.0,/r/opiates/comments/23kau0/looking_for_some_od_advice/,,
Drugs,submissions,1491230964,2017-04-03 14:49:24+00:00,2017-04,1,['narcan'],1,FlunkyJunky,6378fo,Smoking oxycodone with Narcan?,Smoking oxycodone with Narcan?,0.0,/r/Drugs/comments/6378fo/smoking_oxycodone_with_narcan/,,
opiates,submissions,1543424289,2018-11-28 16:58:09+00:00,2018-11,3,['narcan'],2,monstrousnuggets,a180ga,"Would adding 30-50mg diazepam with a half sized shot really be so dangerous? I have a friend with narcan on hand in case I really want to experience the opiate/benzo combo, for the nice opiate high minus my constant anxiety, and the only thing that helps my anxiety is a benzo. So would a small, 30-50mg dose of diazepam REALLY be that dangerous? Especially if I cut my shot size in half? Please don't tell me not to do it.. I know it's risky and I've gotten someone to come look after me with narcan if needed now. But would that smallish dose of diazepam combined with a half shot really be so dangerous? Like I say, I have someone on hand to narcan me if needed.. But with a half shot and 30-50mg diazepam I should be good right?",Would adding 30-50mg diazepam with a half sized shot really be so dangerous? I have a friend with narcan on hand in case,6.0,/r/opiates/comments/a180ga/would_adding_3050mg_diazepam_with_a_half_sized/,,
Drugs,submissions,1661028715,2022-08-20 20:51:55+00:00,2022-08,2,['naloxone'],0,Rurounin89,wth6db,"Difference between subutex/uxone? Is it like oxycontin/targiniq? Greetings folks! Quick questions, getting subuxones instead of subutex if it isnt imported/fake ones if there is a market for that? Maybe bigger difference for subuxone if its going intranasal for higher BA for both the bup and naloxone, but if I take it sublingual then I will waste the bup and need higher doeses than intranasal? What do you pay on the streets for a 8mg sublingual tab? In pharmacy its around €100 for 28 tabs but the government subventions subuoxone where I live so after 2x28 tabs cartoon you are almost in free zone, which means all precipription drugs will be free and the bill is on the government instead, Kicks in when youve bought medicines for around €220 under a year. &amp;#x200B; The offer I get now is 10x8mg tabs for €150, pharmacy grade stuff, worth it? from a perspective of price &amp;#x200B; Right of now I have tolerance and dependecy on pregabalin 150mg/daily, alprazolam 0,5mg-1mg/daily 5-10mg diazepam/daily. Those are my legit prescriptioned drugs, then at my disposal I have 2mgs clonazepam that can greatly lower alprazolam and or diazepam, even strong enough to not mix in alpra and or dia while clonazepam is doing its work. A little more than 1 year of daily doses around 200-400mg tramadol, pharmacy grade until 1 month ago Ive had to hold 300-400mg (generic press which seems legit) to just mitigate WD symptoms and feel a little of the typical opi euphoria and moodlifting but the body really have become dependent on my opi receptors all over my body needs a reset. Hence buprenorphine since Ive failed tapering down tramadol on my own (know how ot handle bup at least so Im not losing driver license, kids and other stuff, where I live to get a sub treatment for a tramadol addiction....) They wouldve laughed, maybe given me 2 weeks of tapering down doses then thats it. If it were so easy I would have made it with 15+ cartoons of 100 capsules per cartoon and 100mg per capsule.... Ive tried Targiniq before and the only difference is better bowel motility with oral administered naloxone, though I still have 1 cartoon of 90 25mg naloxegol I have to use carefully quitting opis (tram and oxycodone mainly) I only need around 0.1-0.2mg intranasal each day and when the WD symptoms is bareable enough I start to jump over doses of buprenorphine since its long acting. Have long experience on slow/fast acting substances, opis, benzos, gabapentiods mainly pregabalin. Though buprenorphine will be a 2nd experience, 1st time I was a total idiot, took about 0.2mg (with tramadol tolerance only) and then also took oral tramadol on top of that bup since the friend that shared it said all opis dont work except tramadol. My hypothesis is that its the SNRI and serotonin releasing acting agent that ppl experience when combining tramadol and bup.With such high affinity made from thebain alkaloid, even heroin doesnt kick in. Thanks in advance! Regards Rurounin",Difference between subutex/uxone? Is it like oxycontin/targiniq?,4.0,/r/Drugs/comments/wth6db/difference_between_subutexuxone_is_it_like/,,
opiates,submissions,1612208924,2021-02-01 19:48:44+00:00,2021-02,2,['naloxone'],1,flynnsanone,lac7vv,Possible to extract naloxone out of my oxy tabs ? Getting my order off targins today 20mg Oxycodone/ 5mg naloxone Was just wondering is it possible to cold water extract them or not possible?,Possible to extract naloxone out of my oxy tabs ?,10.0,/r/opiates/comments/lac7vv/possible_to_extract_naloxone_out_of_my_oxy_tabs/,,
opiates,submissions,1497405317,2017-06-14 01:55:17+00:00,2017-06,1,['naloxone'],2,tylerdurden1993,6h4i7v,"Got prescribed suboxone for depression. I need opinions and advice. So I got persribed 4 mg with 1 mg nalaxone in each 3 times a day. so 12 mg of bupe a day. I have no tolerance to opiates, except kratom which is actually quite high (I can do 30-40 grams no problem after potentiators) Still, from research this seems like an extremely high dose. 4 mg had non tolerant people puking their guts out and shit. Is this a viable option for depression? And will I get high the first few times using it even with the nalaxone in it? I've tried almost everything. My doc said if this doesn't work he will give me ketamine. Also can I take other drugs with this? Am perscribed 30 mg of diaz, 3 of clonaz, 30 of dexedrine, as well as a weed smoker and kratom eater. Will this naloxone fuck with the kratom? I should note that I take 30 mg of valium a day, sometimes a few extra benzos in addition. I got 3 mg of xanax a day but I have plenty of xans laying around so I asked him to switch me to clonazepam which he did. Should I be worried about CNS depression? I know the risk is always there but how is it with bupe. Any other drugs I should avoid or that go well with it? Also 30 mg of dextroamphetamine daily but i don't take them too often. How hard will this fuck me up the first few times. As stated whatever opiod tolerace I have is from 3 days of kratom, and I have also been using dxm and memantine to preent tolerance buildup. And I'm worried about starting an addiction. What if this works too well? I love opiates but I keep myself away from connects so I don't get hooked. I take them when they come around from friends or whatever. But if I have a daily dose of bupe...",Got prescribed suboxone for depression. I need opinions and advice.,23.0,/r/opiates/comments/6h4i7v/got_prescribed_suboxone_for_depression_i_need/,,
